Item Title,Publication Title,Book Series Title,Journal Volume,Journal Issue,Item DOI,Authors,Publication Year,URL,Content Type
"Meta-interpretive learning of higher-order dyadic datalog: predicate invention revisited","Machine Learning","","100","1","10.1007/s10994-014-5471-y","Stephen H. MuggletonDianhuan LinAlireza Tamaddoni-Nezhad","2015","http://link.springer.com/article/10.1007/s10994-014-5471-y","Article"
"Motion analysis for event detection and tracking with a mobile omnidirectional camera","Multimedia Systems","","10","2","10.1007/s00530-004-0146-3","Tarak GandhiMohan M. Trivedi","2004","http://link.springer.com/article/10.1007/s00530-004-0146-3","Article"
"2D Histogram-based player localization in broadcast volleyball videos","Multimedia Systems","","22","3","10.1007/s00530-015-0463-8","Chun-Chieh HsuHua-Tsung ChenChien-Li ChouSuh-Yin Lee","2016","http://link.springer.com/article/10.1007/s00530-015-0463-8","Article"
"Printed Arabic character recognition using HMM","Journal of Computer Science and Technology","","19","4","10.1007/BF02944755","Abbas H. HassinXiang-Long TangJia-Feng LiuWei Zhao","2004","http://link.springer.com/article/10.1007/BF02944755","Article"
"Human Factors in Web Adaptation and Personalization","Human-Centred Web Adaptation and Personalization","","","","10.1007/978-3-319-28050-9_2","Panagiotis GermanakosMarios Belk","2016","http://link.springer.com/chapter/10.1007/978-3-319-28050-9_2","Chapter"
"Identifying Join Candidates in the Cairo Genizah","International Journal of Computer Vision","","94","1","10.1007/s11263-010-0389-8","Lior WolfRotem LittmanNaama MayerTanya GermanNachum DershowitzRoni ShwekaYaacov Choueka","2011","http://link.springer.com/article/10.1007/s11263-010-0389-8","Article"
"Indexing Multidimensional Time-Series","The VLDB Journal","","15","1","10.1007/s00778-004-0144-2","Michail VlachosMarios HadjieleftheriouDimitrios GunopulosEamonn Keogh","2006","http://link.springer.com/article/10.1007/s00778-004-0144-2","Article"
"Parameter Learning in Probabilistic Databases: A Least Squares Approach","Machine Learning and Knowledge Discovery in Databases","","","","10.1007/978-3-540-87479-9_49","Bernd GutmannAngelika KimmigKristian KerstingLuc De Raedt","2008","http://link.springer.com/chapter/10.1007/978-3-540-87479-9_49","Chapter"
"A memory-based approach to sensory-motor coordination","Machine Vision and Applications","","10","5 - 6","10.1007/s001380050078","Nicola VeneriStefano MesselodiBruno Crespi","1998","http://link.springer.com/article/10.1007/s001380050078","Article"
"Learning on the fly: a font-free approach toward multilingual OCR","International Journal on Document Analysis and Recognition (IJDAR)","","14","3","10.1007/s10032-011-0164-6","Andrew KaeDavid A. SmithErik Learned-Miller","2011","http://link.springer.com/article/10.1007/s10032-011-0164-6","Article"
"Semantics of a Multimedia Database for Support within Synthetic Environments for Multiple Sensor Systems","Database Semantics","","","","10.1007/978-0-387-35561-0_23","Gerald SterlingElizabeth ChangTharam Dillon","1999","http://link.springer.com/chapter/10.1007/978-0-387-35561-0_23","Chapter"
"Webmind","Creating Internet Intelligence","","","","10.1007/978-1-4615-0561-7_12","Ben Goertzel","2002","http://link.springer.com/chapter/10.1007/978-1-4615-0561-7_12","Chapter"
"Gaze movement-driven random forests for query clustering in automatic video annotation","Multimedia Tools and Applications","","76","2","10.1007/s11042-015-3221-1","Stefanos VrochidisIoannis PatrasIoannis Kompatsiaris","2017","http://link.springer.com/article/10.1007/s11042-015-3221-1","Article"
"Networking Readers: Using Semantic and Geographical Links to Enhance e-Books Reading Experience","Computational Collective Intelligence","","","","10.1007/978-3-319-45246-3_6","Dan CristeaIonuț PistolDaniela GîfuDaniel Anechitei","2016","http://link.springer.com/chapter/10.1007/978-3-319-45246-3_6","Chapter"
"Mobile authoring of open educational resources for authentic learning scenarios","Universal Access in the Information Society","","15","3","10.1007/s10209-014-0391-y","Bernardo TabuencaMarco KalzStefaan TernierMarcus Specht","2016","http://link.springer.com/article/10.1007/s10209-014-0391-y","Article"
"An n-gram-based approach for detecting approximately duplicate database records","International Journal on Digital Libraries","","3","4","10.1007/s007990100044","Zengping TianHongjun LuWenyun JiAoying ZhouZhong Tian","2002","http://link.springer.com/article/10.1007/s007990100044","Article"
"Near Duplicate Document Detection for Large Information Flows","Multidisciplinary Research and Practice for Information Systems","","","","10.1007/978-3-642-32498-7_16","Daniele MontanariPiera Laura Puglisi","2012","http://link.springer.com/chapter/10.1007/978-3-642-32498-7_16","Chapter"
"The Eras and Trends of Automatic Short Answer Grading","International Journal of Artificial Intelligence in Education","","25","1","10.1007/s40593-014-0026-8","Steven BurrowsIryna GurevychBenno Stein","2015","http://link.springer.com/article/10.1007/s40593-014-0026-8","Article"
"Ontology-Driven Information Extraction with OntoSyphon","The Semantic Web - ISWC 2006","","","","10.1007/11926078_31","Luke K. McDowellMichael Cafarella","2006","http://link.springer.com/chapter/10.1007/11926078_31","Chapter"
"An effective real-time color quantization method based on divisive hierarchical clustering","Journal of Real-Time Image Processing","","10","2","10.1007/s11554-012-0291-4","M. Emre CelebiQuan WenSae Hwang","2015","http://link.springer.com/article/10.1007/s11554-012-0291-4","Article"
"Self-training for Handwritten Text Line Recognition","Progress in Pattern Recognition, Image Analysis, Computer Vision, and Applications","","","","10.1007/978-3-642-16687-7_18","Volkmar FrinkenHorst Bunke","2010","http://link.springer.com/chapter/10.1007/978-3-642-16687-7_18","Chapter"
"A Multimedia System Architecture for Automatic Annotation of Sports Videos","Computer Vision Systems","","","","10.1007/3-540-36592-3_49","William ChristmasEdward JaserKieron MesserJosef Kittler","2003","http://link.springer.com/chapter/10.1007/3-540-36592-3_49","Chapter"
"Multimedia Content Analysis: The Next Wave","Image and Video Retrieval","","","","10.1007/3-540-45113-7_2","Nevenka Dimitrova","2003","http://link.springer.com/chapter/10.1007/3-540-45113-7_2","Chapter"
"Recognising text in real scenes","International Journal on Document Analysis and Recognition","","4","4","10.1007/s10032-001-0072-2","Paul ClarkMajid Mirmehdi","2002","http://link.springer.com/article/10.1007/s10032-001-0072-2","Article"
"The Parctab Ubiquitous Computing Experiment","Mobile Computing","","","","10.1007/978-0-585-29603-6_2","Roy WantBill N. SchilitNorman I. AdamsRich GoldKarin PetersenDavid GoldbergJohn R. EllisMark Weiser","1996","http://link.springer.com/chapter/10.1007/978-0-585-29603-6_2","Chapter"
"Data Input","Microcomputer","","","","10.1007/978-1-4615-9998-2_8","Kenneth L. Bowles","1977","http://link.springer.com/chapter/10.1007/978-1-4615-9998-2_8","Chapter"
"Can eyes reveal interest? Implicit queries from gaze patterns","User Modeling and User-Adapted Interaction","","19","4","10.1007/s11257-009-9066-4","Antti AjankiDavid R. HardoonSamuel KaskiKai PuolamäkiJohn Shawe-Taylor","2009","http://link.springer.com/article/10.1007/s11257-009-9066-4","Article"
"Data Input","Microcomputer","","","","10.1007/978-3-662-38578-4_8","Kenneth L. Bowles","1977","http://link.springer.com/chapter/10.1007/978-3-662-38578-4_8","Chapter"
"Video databases: An emerging tool in business education","Education and Information Technologies","","19","1","10.1007/s10639-012-9213-0","Gregory MacKinnonConor Vibert","2014","http://link.springer.com/article/10.1007/s10639-012-9213-0","Article"
"Improvement in environmental accessibility via volunteered geographic information: a case study","Universal Access in the Information Society","","16","4","10.1007/s10209-016-0505-9","Limin ZengRomina KühnGerhard Weber","2017","http://link.springer.com/article/10.1007/s10209-016-0505-9","Article"
"Measuring acceptable input: What is “good enough”?","Universal Access in the Information Society","","16","3","10.1007/s10209-016-0498-4","Simeon Keates","2017","http://link.springer.com/article/10.1007/s10209-016-0498-4","Article"
"A Comprehensive Overview of Visual Design of Process Model Element Labels","Business Process Management Workshops","","","","10.1007/978-3-319-42887-1_46","Agnes KoschmiderKathrin FiglAndreas Schoknecht","2016","http://link.springer.com/chapter/10.1007/978-3-319-42887-1_46","Chapter"
"The use of explicit goals for knowledge to guide inference and learning","Applied Intelligence","","2","1","10.1007/BF00058575","Ashwin RamLawrence Hunter","1992","http://link.springer.com/article/10.1007/BF00058575","Article"
"Naive Semantics","Naive Semantics for Natural Language Understanding","","","","10.1007/978-1-4613-1075-4_1","Kathleen Dahlgren","1988","http://link.springer.com/chapter/10.1007/978-1-4613-1075-4_1","Chapter"
"Combining Concept Mapping and Adaptive Advice to Teach Reading Comprehension","J.UCS The Journal of Universal Computer Science","","","","10.1007/978-3-642-80350-5_14","Patricia A. Carlson Ph.D.Veronica Larralde","1996","http://link.springer.com/chapter/10.1007/978-3-642-80350-5_14","Chapter"
"Tilt-Based Automatic Zooming and Scaling in Mobile Devices – A State-Space Implementation","Mobile Human-Computer Interaction - MobileHCI 2004","","","","10.1007/978-3-540-28637-0_11","Parisa EslambolchilarRoderick Murray-Smith","2004","http://link.springer.com/chapter/10.1007/978-3-540-28637-0_11","Chapter"
"Digital media: Bridges between data particles and artifacts","The Visual Computer","","2","3","10.1007/BF01900324","Frank Dietrich","1986","http://link.springer.com/article/10.1007/BF01900324","Article"
"Text line extraction in graphical documents using background and foreground information","International Journal on Document Analysis and Recognition (IJDAR)","","15","3","10.1007/s10032-011-0167-3","Partha Pratim RoyUmapada PalJosep Lladós","2012","http://link.springer.com/article/10.1007/s10032-011-0167-3","Article"
"Detecting Events in Online Social Networks: Definitions, Trends and Challenges","Solving Large Scale Learning Tasks. Challenges and Algorithms","","","","10.1007/978-3-319-41706-6_2","Nikolaos PanagiotouIoannis KatakisDimitrios Gunopulos","2016","http://link.springer.com/chapter/10.1007/978-3-319-41706-6_2","Chapter"
"Document Analysis Systems for Digital Libraries: Challenges and Opportunities","Document Analysis Systems VI","","","","10.1007/978-3-540-28640-0_1","Henry S. BairdVenugopal GovindarajuDaniel P. Lopresti","2004","http://link.springer.com/chapter/10.1007/978-3-540-28640-0_1","Chapter"
"Document skew estimation without angle range restriction","International Journal on Document Analysis and Recognition","","2","2 - 3","10.1007/s100320050043","Oleg OkunMatti PietikäinenJaakko Sauvola","1999","http://link.springer.com/article/10.1007/s100320050043","Article"
"Building cameras for capturing documents","International Journal of Document Analysis and Recognition (IJDAR)","","7","2 - 3","10.1007/s10032-004-0129-0","Stephen PollardMaurizio Pilu","2005","http://link.springer.com/article/10.1007/s10032-004-0129-0","Article"
"Converging Trends Towards Human-Centerednes and Enabling Theories","Human-Centered e-Business","","","","10.1007/978-1-4615-0445-0_3","Rajiv KhoslaErnesto DamianiWilliam Grosky","2003","http://link.springer.com/chapter/10.1007/978-1-4615-0445-0_3","Chapter"
"Finite-State Approaches to Web Information Extraction","Information Extraction in the Web Era","","","","10.1007/978-3-540-45092-4_4","Nicholas Kushmerick","2003","http://link.springer.com/chapter/10.1007/978-3-540-45092-4_4","Chapter"
"Language, vision and metaphor","Artificial Intelligence Review","","9","4 - 5","10.1007/BF00849040","Yorick Wilks","1995","http://link.springer.com/article/10.1007/BF00849040","Article"
"Advanced lexical ontologies and hybrid knowledge based systems: First steps to a dynamic legal electronic commentary","Artificial Intelligence and Law","","15","2","10.1007/s10506-007-9029-1","Erich SchweighoferDoris Liebwald","2007","http://link.springer.com/article/10.1007/s10506-007-9029-1","Article"
"Language, Vision and Metaphor","Integration of Natural Language and Vision Processing","","","","10.1007/978-94-009-1639-5_4","Yorick Wilks","1996","http://link.springer.com/chapter/10.1007/978-94-009-1639-5_4","Chapter"
"Max Margin Learning of Hierarchical Configural Deformable Templates (HCDTs) for Efficient Object Parsing and Pose Estimation","International Journal of Computer Vision","","93","1","10.1007/s11263-010-0375-1","Long (Leo) ZhuYuanhao ChenChenxi LinAlan Yuille","2011","http://link.springer.com/article/10.1007/s11263-010-0375-1","Article"
"Information extraction from multimedia web documents: an open-source platform and testbed","International Journal of Multimedia Information Retrieval","","3","2","10.1007/s13735-014-0051-2","David Paul DupplawMichael MatthewsRichard JohanssonGiulia BoatoAndrea CostanzoMarco FontaniEnrico MinackElena DemidovaRoi BlancoThomas GriffithsPaul LewisJonathon HareAlessandro Moschitti","2014","http://link.springer.com/article/10.1007/s13735-014-0051-2","Article"
"A Natural Language Processing Tool for White Collar Crime Investigation","Transactions on Large-Scale Data- and Knowledge-Centered Systems XXIII","","","","10.1007/978-3-662-49175-1_1","Maarten van BanerveldMohand-Tahar KechadiNhien-An Le-Khac","2016","http://link.springer.com/chapter/10.1007/978-3-662-49175-1_1","Chapter"
"Locator slope calculation via deep representations based on monocular vision","Neural Computing and Applications","","","","10.1007/s00521-017-3229-8","Yang YangWensheng ZhangZewen HeDongjie Chen","2017","http://link.springer.com/article/10.1007/s00521-017-3229-8","Article"
"An experimental evaluation of the importance of randomness in hill climbing searches applied to software engineering problems","Empirical Software Engineering","","19","5","10.1007/s10664-013-9294-4","Márcio de O. Barros","2014","http://link.springer.com/article/10.1007/s10664-013-9294-4","Article"
"Conference Mining via Generalized Topic Modeling","Machine Learning and Knowledge Discovery in Databases","","","","10.1007/978-3-642-04180-8_33","Ali DaudJuanzi LiLizhu ZhouFaqir Muhammad","2009","http://link.springer.com/chapter/10.1007/978-3-642-04180-8_33","Chapter"
"Large-Scale Learning of Relation-Extraction Rules with Distant Supervision from the Web","The Semantic Web – ISWC 2012","","","","10.1007/978-3-642-35176-1_17","Sebastian KrauseHong LiHans UszkoreitFeiyu Xu","2012","http://link.springer.com/chapter/10.1007/978-3-642-35176-1_17","Chapter"
"Computer vision and GIS for the navigation of blind persons in buildings","Universal Access in the Information Society","","14","1","10.1007/s10209-013-0338-8","M. SerrãoS. ShahrabadiM. MorenoJ. T. JoséJ. I. RodriguesJ. M. F. RodriguesJ. M. H. du Buf","2015","http://link.springer.com/article/10.1007/s10209-013-0338-8","Article"
"Optimization of the material handling costs and the machine reliability in cellular manufacturing system using cuckoo search algorithm","Neural Computing and Applications","","","","10.1007/s00521-017-3302-3","Bouchra KaroumYoussef Bouazza Elbenani","2018","http://link.springer.com/article/10.1007/s00521-017-3302-3","Article"
"Offline cursive script word recognition – a survey","International Journal on Document Analysis and Recognition","","2","2 - 3","10.1007/s100320050040","Tal SteinherzEhud RivlinNathan Intrator","1999","http://link.springer.com/article/10.1007/s100320050040","Article"
"Using IR Techniques for Text Classification in Document Analysis","SIGIR ’94","","","","10.1007/978-1-4471-2099-5_4","Rainer Hoch","1994","http://link.springer.com/chapter/10.1007/978-1-4471-2099-5_4","Chapter"
"A Language for Audiovisual Template Specification and Recognition","Principles and Practice of Constraint Programming – CP 2000","","","","10.1007/3-540-45349-0_11","Jean CarrivePierre RoyFrançois PachetRémi Ronfard","2000","http://link.springer.com/chapter/10.1007/3-540-45349-0_11","Chapter"
"A Mobile Recognition System for Analog Energy Meter Scanning","Advances in Visual Computing","","","","10.1007/978-3-319-50835-1_23","Martin CermanGayane ShaluntsDaniel Albertini","2016","http://link.springer.com/chapter/10.1007/978-3-319-50835-1_23","Chapter"
"DaLI: Deformation and Light Invariant Descriptor","International Journal of Computer Vision","","115","2","10.1007/s11263-015-0805-1","Edgar Simo-SerraCarme TorrasFrancesc Moreno-Noguer","2015","http://link.springer.com/article/10.1007/s11263-015-0805-1","Article"
"Context-Based Fusion of Physical and Human Data for Level 5 Information Fusion","Context-Enhanced Information Fusion","","","","10.1007/978-3-319-28971-7_18","Erik BlaschRiad I. HammoudHaibin LingDan ShenJames NagyGenshe Chen","2016","http://link.springer.com/chapter/10.1007/978-3-319-28971-7_18","Chapter"
"Semi-supervised dictionary learning with label propagation for image classification","Computational Visual Media","","3","1","10.1007/s41095-016-0073-1","Lin ChenMeng Yang","2017","http://link.springer.com/article/10.1007/s41095-016-0073-1","Article"
"The ROAD from Sensor Data to Process Instances via Interaction Mining","Advanced Information Systems Engineering","","","","10.1007/978-3-319-39696-5_16","Arik SenderovichAndreas Rogge-SoltiAvigdor GalJan MendlingAvishai Mandelbaum","2016","http://link.springer.com/chapter/10.1007/978-3-319-39696-5_16","Chapter"
"Contextual cropping and scaling of TV productions","Multimedia Tools and Applications","","61","3","10.1007/s11042-011-0804-3","Joerg DeigmoellerTakebumi ItagakiNorbert JustGerhard Stoll","2012","http://link.springer.com/article/10.1007/s11042-011-0804-3","Article"
"A HMM-Based Approach to Recognize Ultra Low Resolution Anti-Aliased Words","Pattern Recognition and Machine Intelligence","","","","10.1007/978-3-540-77046-6_63","Farshideh EinseleRolf IngoldJean Hennebert","2007","http://link.springer.com/chapter/10.1007/978-3-540-77046-6_63","Chapter"
"A survey of assistive technologies and applications for blind users on mobile platforms: a review and foundation for research","Journal on Multimodal User Interfaces","","9","4","10.1007/s12193-015-0182-7","Ádám CsapóGyörgy WersényiHunor NagyTony Stockman","2015","http://link.springer.com/article/10.1007/s12193-015-0182-7","Article"
"Exploring the Use of Distributed Multiple Monitors within an Activity-Promoting Sit-and-Stand Office Workspace","Human-Computer Interaction – INTERACT 2013","","","","10.1007/978-3-642-40477-1_30","Kathrin ProbstDavid LindlbauerFlorian PertenederMichael HallerBernhard SchwartzAndreas Schrempf","2013","http://link.springer.com/chapter/10.1007/978-3-642-40477-1_30","Chapter"
"Neural Network Agents for Learning Semantic Text Classification","Information Retrieval","","3","2","10.1023/A:1009942513170","Stefan Wermter","2000","http://link.springer.com/article/10.1023/A%3A1009942513170","Article"
"A Parametrizable Task-Adaptive NE-Recognition System","Databases and Information Systems II","","","","10.1007/978-94-015-9978-8_24","Jakub PiskorskiTilman JägerFeiyu Xu","2002","http://link.springer.com/chapter/10.1007/978-94-015-9978-8_24","Chapter"
"Automatic performance evaluation of printed Chinese character recognition systems","International Journal on Document Analysis and Recognition","","4","3","10.1007/s100320200068","Chi FangChangsong LiuLiangrui PengXiaoqing Ding","2002","http://link.springer.com/article/10.1007/s100320200068","Article"
"Group topic modeling for academic knowledge discovery","Applied Intelligence","","36","4","10.1007/s10489-011-0302-3","Ali DaudFaqir Muhammad","2012","http://link.springer.com/article/10.1007/s10489-011-0302-3","Article"
"Systems and architectures for multimedia information retrieval","Multimedia Systems","","10","6","10.1007/s00530-005-0174-7","Chabane DjerabaNicu SebeMichael S. Lew","2005","http://link.springer.com/article/10.1007/s00530-005-0174-7","Article"
"An Index for Two Dimensional String Matching Allowing Rotations","Theoretical Computer Science: Exploring New Frontiers of Theoretical Informatics","","","","10.1007/3-540-44929-9_5","Kimmo FredrikssonGonzalo NavarroEsko Ukkonen","2000","http://link.springer.com/chapter/10.1007/3-540-44929-9_5","Chapter"
"Group and Groupware Principles","Interactive Media","","","","10.1007/978-1-4612-4226-0_6","Roy Rada","1995","http://link.springer.com/chapter/10.1007/978-1-4612-4226-0_6","Chapter"
"Fingerprint Classification by Decision Fusion","Automatic Fingerprint Recognition Systems","","","","10.1007/0-387-21685-5_10","Andrew SeniorRuud Bolle","2004","http://link.springer.com/chapter/10.1007/0-387-21685-5_10","Chapter"
"Hybrid model of clustering and kernel autoassociator for reliable vehicle type classification","Machine Vision and Applications","","25","2","10.1007/s00138-013-0588-8","Bailing ZhangYifan ZhouHao PanTammam Tillo","2014","http://link.springer.com/article/10.1007/s00138-013-0588-8","Article"
"A categorization system for handwritten documents","International Journal on Document Analysis and Recognition (IJDAR)","","15","4","10.1007/s10032-011-0173-5","Thierry PaquetLaurent HeutteGuillaume KochClément Chatelain","2012","http://link.springer.com/article/10.1007/s10032-011-0173-5","Article"
"Mutual Spotting Retrieval between Speech and Video Image Using Self-Organized Network Databases","Advanced Multimedia Content Processing","","","","10.1007/3-540-48962-2_8","Takashi EndoJian Xin ZhangMasakyuki NakazawaRyuichi Oka","1999","http://link.springer.com/chapter/10.1007/3-540-48962-2_8","Chapter"
"OCR as a Service: An Experimental Evaluation of Google Docs OCR, Tesseract, ABBYY FineReader, and Transym","Advances in Visual Computing","","","","10.1007/978-3-319-50835-1_66","Ahmad P. TaftiAhmadreza BaghaieMehdi AssefiHamid R. ArabniaZeyun YuPeggy Peissig","2016","http://link.springer.com/chapter/10.1007/978-3-319-50835-1_66","Chapter"
"Improving reading comprehension step by step using Online-Boost text readability classification system","Neural Computing and Applications","","26","4","10.1007/s00521-014-1770-2","Lei LaNan WangDong-ping Zhou","2015","http://link.springer.com/article/10.1007/s00521-014-1770-2","Article"
"Ontology-based mobile augmented reality in cultural heritage sites: information modeling and user study","Multimedia Tools and Applications","","76","24","10.1007/s11042-017-4868-6","Hayun KimTamás MatuszkaJea-In KimJungwha KimWoontack Woo","2017","http://link.springer.com/article/10.1007/s11042-017-4868-6","Article"
"Modelling in Action","Design, Specification and Verification of Interactive Systems ’97","","","","10.1007/978-3-7091-6878-3_20","Robert E. FieldsNicholas A. Merriam","1997","http://link.springer.com/chapter/10.1007/978-3-7091-6878-3_20","Chapter"
"Gaze point estimation on curved display by using session level calibration for flat screen displays","Multimedia Tools and Applications","","77","6","10.1007/s11042-017-4616-y","Simona RamanauskaitėAntanas ČenysEglė RadvilėNerijus Ramanauskas","2018","http://link.springer.com/article/10.1007/s11042-017-4616-y","Article"
"Modelling Human Machine Interaction: Techniques for Prediction of Performance","Empirical Foundations of Information and Software Science V","","","","10.1007/978-1-4684-5862-6_19","Ömer Akin","1990","http://link.springer.com/chapter/10.1007/978-1-4684-5862-6_19","Chapter"
"A Component-Based Framework for Recognition Systems","Reading and Learning","","","","10.1007/978-3-540-24642-8_10","Matthias MiddendorfCarsten PeustJohannes Schacht","2004","http://link.springer.com/chapter/10.1007/978-3-540-24642-8_10","Chapter"
"Look or Listen: Discovering Effective Techniques for Accessing Speech Data","People and Computers XVII — Designing for Society","","","","10.1007/978-1-4471-3754-2_13","Steve WhittakerJulia Hirschberg","2004","http://link.springer.com/chapter/10.1007/978-1-4471-3754-2_13","Chapter"
"Complete Examples","Specification and Transformation of Programs","","","","10.1007/978-3-642-61512-2_9","Helmut A. Partsch","1990","http://link.springer.com/chapter/10.1007/978-3-642-61512-2_9","Chapter"
"Technostress in the office: a distributed cognition perspective on human–technology interaction","Cognition, Technology & Work","","16","2","10.1007/s10111-013-0256-9","Charlott SellbergTarja Susi","2014","http://link.springer.com/article/10.1007/s10111-013-0256-9","Article"
"Two-Phase Updating of Student Models Based on Dynamic Belief Networks","Intelligent Tutoring Systems","","","","10.1007/3-540-68716-5_33","Jim Reye","1998","http://link.springer.com/chapter/10.1007/3-540-68716-5_33","Chapter"
"Smarttext: Using agents supporting personalised reading comprehension","Personal Technologies","","2","3","10.1007/BF01321173","Igor A. Chemyr Ph. D.Mark A. HorneyLynne Anderson-Inman","1998","http://link.springer.com/article/10.1007/BF01321173","Article"
"A belief net backbone for student modelling","Intelligent Tutoring Systems","","","","10.1007/3-540-61327-7_159","Jim Reye","1996","http://link.springer.com/chapter/10.1007/3-540-61327-7_159","Chapter"
"Modifying Multi-user Discussion Systems to Support Text-based Virtual Learning Environments on the Web — the coMentor Experience","The Digital University","","","","10.1007/978-1-4471-0625-8_9","Graham R. Gibbs","1998","http://link.springer.com/chapter/10.1007/978-1-4471-0625-8_9","Chapter"
"Interactive ant colony optimization (iACO) for early lifecycle software design","Swarm Intelligence","","8","2","10.1007/s11721-014-0094-2","Christopher L. SimonsJim SmithPaul White","2014","http://link.springer.com/article/10.1007/s11721-014-0094-2","Article"
