Item Title,Publication Title,Book Series Title,Journal Volume,Journal Issue,Item DOI,Authors,Publication Year,URL,Content Type
"On Learning Conditional Random Fields for Stereo","International Journal of Computer Vision","","99","3","10.1007/s11263-010-0385-z","Christopher J. PalJerod J. WeinmanLam C. TranDaniel Scharstein","2012","http://link.springer.com/article/10.1007/s11263-010-0385-z","Article"
"Files and Streams","Essential Java 2 fast","","","","10.1007/978-1-4471-0573-2_16","John Cowell BSc(Hons), MPhil, PhD","1999","http://link.springer.com/chapter/10.1007/978-1-4471-0573-2_16","Chapter"
"Improving the print quality of screenshots","Pattern Recognition and Image Analysis","","25","4","10.1134/S1054661815040173","S. M. MikheevI. V. KurilinA. M. Vil’kinM. N. RychagovHo Keun LeeSang Ho KimDon Chul Choi","2015","http://link.springer.com/article/10.1134/S1054661815040173","Article"
"Data GroundTruth, Complexity, and Evaluation Measures for Color Document Analysis","Document Analysis Systems V","","","","10.1007/3-540-45869-7_55","Leon TodoranMarcel WorringArnold W. M. Smeulders","2002","http://link.springer.com/chapter/10.1007/3-540-45869-7_55","Chapter"
"Multi-class segmentation of free-form online documents with tree conditional random fields","International Journal on Document Analysis and Recognition (IJDAR)","","17","4","10.1007/s10032-014-0221-z","Adrien DelayeCheng-Lin Liu","2014","http://link.springer.com/article/10.1007/s10032-014-0221-z","Article"
"A word extraction algorithm for machine-printed documents using a 3D neighborhood graph model","International Journal on Document Analysis and Recognition","","4","2","10.1007/PL00010903","Hwan-Chul ParkSe-Young OkYoung-Jung YuHwan-Gue Cho","2001","http://link.springer.com/article/10.1007/PL00010903","Article"
"End-to-End Interpretation of the French Street Name Signs Dataset","Computer Vision – ECCV 2016 Workshops","","","","10.1007/978-3-319-46604-0_30","Raymond SmithChunhui GuDar-Shyang LeeHuiyi HuRanjith UnnikrishnanJulian IbarzSacha ArnoudSophia Lin","2016","http://link.springer.com/chapter/10.1007/978-3-319-46604-0_30","Chapter"
"Entropy-Based Localization of Textured Regions","Image Analysis and Processing – ICIAP 2011","","","","10.1007/978-3-642-24085-0_63","Liliana Lo PrestiMarco La Cascia","2011","http://link.springer.com/chapter/10.1007/978-3-642-24085-0_63","Chapter"
"Arabic Bank Check Processing: State of the Art","Journal of Computer Science and Technology","","28","2","10.1007/s11390-013-1332-6","Irfan AhmadSabri A. Mahmoud","2013","http://link.springer.com/article/10.1007/s11390-013-1332-6","Article"
"GPUSVM: a comprehensive CUDA based support vector machine package","Central European Journal of Computer Science","","1","4","10.2478/s13537-011-0028-7","Qi LiRaied SalmanErik TestRobert StrackVojislav Kecman","2011","http://link.springer.com/article/10.2478/s13537-011-0028-7","Article"
"Semantic Characterization of Visual Content for Sports Videos Annotation","Multimedia Databases and Image Communication","","","","10.1007/3-540-44819-5_15","Jürgen AssfalgMarco BertiniCarlo ColomboAlberto Del Bimbo","2001","http://link.springer.com/chapter/10.1007/3-540-44819-5_15","Chapter"
"Cursive Word Recognition: Methods and Strategies","Fundamentals in Handwriting Recognition","","","","10.1007/978-3-642-78646-4_14","Eric LecolinetOlivier Baret","1994","http://link.springer.com/chapter/10.1007/978-3-642-78646-4_14","Chapter"
"A survey on Arabic character segmentation","International Journal on Document Analysis and Recognition (IJDAR)","","16","2","10.1007/s10032-012-0188-6","Yasser M. Alginahi","2013","http://link.springer.com/article/10.1007/s10032-012-0188-6","Article"
"DIBCO 2009: document image binarization contest","International Journal on Document Analysis and Recognition (IJDAR)","","14","1","10.1007/s10032-010-0115-7","B. GatosK. NtirogiannisI. Pratikakis","2011","http://link.springer.com/article/10.1007/s10032-010-0115-7","Article"
"A checklist for assessing blind users’ usability of educational smartphone applications","Universal Access in the Information Society","","","","10.1007/s10209-017-0585-1","Yekyung LeeJihyun Lee","2017","http://link.springer.com/article/10.1007/s10209-017-0585-1","Article"
"A system for supporting paper-based augmented reality","Multimedia Tools and Applications","","75","6","10.1007/s11042-014-2439-7","Ho-Sub RyuHanhoon Park","2016","http://link.springer.com/article/10.1007/s11042-014-2439-7","Article"
"Enhancing education through natural interaction with physical paper","Universal Access in the Information Society","","14","3","10.1007/s10209-014-0365-0","George MargetisXenophon ZabulisStavroula NtoaPanagiotis KoutlemanisEleni PapadakiMargherita AntonaConstantine Stephanidis","2015","http://link.springer.com/article/10.1007/s10209-014-0365-0","Article"
"A cognitive and video-based approach for multinational License Plate Recognition","Machine Vision and Applications","","22","2","10.1007/s00138-010-0246-3","Nicolas ThomeAntoine VacavantLionel RobinaultSerge Miguet","2011","http://link.springer.com/article/10.1007/s00138-010-0246-3","Article"
"Human Interactive Proofs and Document Image Analysis","Document Analysis Systems V","","","","10.1007/3-540-45869-7_54","Henry S. BairdKris Popat","2002","http://link.springer.com/chapter/10.1007/3-540-45869-7_54","Chapter"
"Automatic real-time road marking recognition using a feature driven approach","Machine Vision and Applications","","23","1","10.1007/s00138-010-0289-5","Alireza KheyrollahiToby P. Breckon","2012","http://link.springer.com/article/10.1007/s00138-010-0289-5","Article"
"Algebraic visual symbolism for problem solving: iconic equations from Diophantus to the present","Visual and Spatial Analysis","","","","10.1007/978-1-4020-2958-5_5","Boris KovalerchukJames Schwing","2004","http://link.springer.com/chapter/10.1007/978-1-4020-2958-5_5","Chapter"
"Text Enhancement by PDE’s Based Methods","Image and Signal Processing","","","","10.1007/978-3-642-31254-0_8","Zouhir MahaniJalal ZahidSahar SaoudMohammed El RhabiAbdelilah Hakim","2012","http://link.springer.com/chapter/10.1007/978-3-642-31254-0_8","Chapter"
"Deterministic Generative Models for Fast Feature Discovery","Data Mining and Knowledge Discovery","","5","4","10.1023/A:1011405212443","Machiel WesterdijkDavid BarberWim Wiegerinck","2001","http://link.springer.com/article/10.1023/A%3A1011405212443","Article"
"GameSense: game-like in-image advertising","Multimedia Tools and Applications","","49","1","10.1007/s11042-009-0399-0","Lusong LiTao MeiXian-Sheng Hua","2010","http://link.springer.com/article/10.1007/s11042-009-0399-0","Article"
"Regions in Binary Images","Digital Image Processing","","","","10.1007/978-1-4471-6684-9_10","Wilhelm BurgerMark J. Burge","2016","http://link.springer.com/chapter/10.1007/978-1-4471-6684-9_10","Chapter"
"Segmentation techniques for recognition of Arabic-like scripts: A comprehensive survey","Education and Information Technologies","","21","5","10.1007/s10639-015-9377-5","Saeeda NazArif I. UmarSyed H. ShiraziSaad B. AhmedMuhammad I. RazzakImran Siddiqi","2016","http://link.springer.com/article/10.1007/s10639-015-9377-5","Article"
"Parsing Images into Regions, Curves, and Curve Groups","International Journal of Computer Vision","","69","2","10.1007/s11263-006-6995-9","Zhuowen TuSong-Chun Zhu","2006","http://link.springer.com/article/10.1007/s11263-006-6995-9","Article"
"Can Design Choices for Language-Based Editors be Analysed with Keystroke-Level Models?","People and Computers XI","","","","10.1007/978-1-4471-3588-3_7","Mark A. TolemanJim Welsh","1996","http://link.springer.com/chapter/10.1007/978-1-4471-3588-3_7","Chapter"
"More Applications of Neural Networks","Neural Networks","","","","10.1007/978-3-642-57760-4_8","Professor Dr. Berndt MüllerDr. Joachim ReinhardtMichael T. Strickland","1995","http://link.springer.com/chapter/10.1007/978-3-642-57760-4_8","Chapter"
"ICDAR 2009-Arabic handwriting recognition competition","International Journal on Document Analysis and Recognition (IJDAR)","","14","1","10.1007/s10032-010-0117-5","Haikal El AbedVolker Märgner","2011","http://link.springer.com/article/10.1007/s10032-010-0117-5","Article"
"Symbolic Learning Techniques in Paper Document Processing","Machine Learning and Data Mining in Pattern Recognition","","","","10.1007/3-540-48097-8_13","Oronzo AltamuraFloriana EspositoFrancesca A. LisiDonato Malerba","1999","http://link.springer.com/chapter/10.1007/3-540-48097-8_13","Chapter"
"Smooth Gaze: a framework for recovering tasks across devices using eye tracking","Personal and Ubiquitous Computing","","","","10.1007/s00779-018-1115-8","Shiwei ChengJing FanAnind K. Dey","2018","http://link.springer.com/article/10.1007/s00779-018-1115-8","Article"
"Deep learning for detecting inappropriate content in text","International Journal of Data Science and Analytics","","","","10.1007/s41060-017-0088-4","Harish YenalaAshish JhanwarManoj K. ChinnakotlaJay Goyal","2017","http://link.springer.com/article/10.1007/s41060-017-0088-4","Article"
"Editorial for automated media analysis and production for novel TV services","Multimedia Tools and Applications","","63","2","10.1007/s11042-012-1083-3","Gerald FriedlandAlberto MessinaRobbie De SutterMasanori Sano","2013","http://link.springer.com/article/10.1007/s11042-012-1083-3","Article"
"Backup and Restore: A DBA’s Bread and Butter","Real-World SQL-DMO for SQL Server","","","","10.1007/978-1-4302-1108-2_2","Allan MitchellMark Allison","2003","http://link.springer.com/chapter/10.1007/978-1-4302-1108-2_2","Chapter"
"Geometry-Based Matching of Routes Between Dissimilar Maps","Challenge of Transport Telematics","","","","10.1007/978-3-319-49646-7_30","Rüdiger EbendtLouis Calvin Touko Tcheumadjeu","2016","http://link.springer.com/chapter/10.1007/978-3-319-49646-7_30","Chapter"
"Big Data Tools and Platforms","Big Data Concepts, Theories, and Applications","","","","10.1007/978-3-319-27763-9_2","Sourav Mazumder","2016","http://link.springer.com/chapter/10.1007/978-3-319-27763-9_2","Chapter"
"Advances in Information Extraction","Knowledge-Based Information Retrieval and Filtering from the Web","","","","10.1007/978-1-4757-3739-4_2","Jakub Piskorski","2003","http://link.springer.com/chapter/10.1007/978-1-4757-3739-4_2","Chapter"
"Paper check image quality enhancement with Moire reduction","Multimedia Tools and Applications","","76","20","10.1007/s11042-016-4080-0","Jiheon OkSungwook YounGuiwon SeoEuisun ChoiYoonkil BaekChulhee Lee","2017","http://link.springer.com/article/10.1007/s11042-016-4080-0","Article"
"Recognition of Arabic (Indian) bank check digits using log-gabor filters","Applied Intelligence","","35","3","10.1007/s10489-010-0235-2","Sabri A. MahmoudWasfi G. Al-Khatib","2011","http://link.springer.com/article/10.1007/s10489-010-0235-2","Article"
"Semantic Annotation and Indexing of News and Sports Videos","SOFSEM 2002: Theory and Practice of Informatics","","","","10.1007/3-540-36137-5_6","Jürgen AssfalgMarco BertiniCarlo ColomboAlberto Del BimboWalter Nunziati","2002","http://link.springer.com/chapter/10.1007/3-540-36137-5_6","Chapter"
"ISANA: Wearable Context-Aware Indoor Assistive Navigation with Obstacle Avoidance for the Blind","Computer Vision – ECCV 2016 Workshops","","","","10.1007/978-3-319-48881-3_31","Bing LiJ. Pablo MuñozXuejian RongJizhong XiaoYingli TianAries Arditi","2016","http://link.springer.com/chapter/10.1007/978-3-319-48881-3_31","Chapter"
"Mathematical formula identification and performance evaluation in PDF documents","International Journal on Document Analysis and Recognition (IJDAR)","","17","3","10.1007/s10032-013-0216-1","Xiaoyan LinLiangcai GaoZhi TangJosef BakerVolker Sorge","2014","http://link.springer.com/article/10.1007/s10032-013-0216-1","Article"
"Footsteps from the Garden — Arcadian Knowledge Spaces","Social Navigation of Information Space","","","","10.1007/978-1-4471-0837-5_14","Andrew McGrathAlan Munro","1999","http://link.springer.com/chapter/10.1007/978-1-4471-0837-5_14","Chapter"
"Footsteps from the Garden: Arcadian Knowledge Spaces","Designing Information Spaces: The Social Navigation Approach","","","","10.1007/978-1-4471-0035-5_8","Andrew McGrathAlan Munro","2003","http://link.springer.com/chapter/10.1007/978-1-4471-0035-5_8","Chapter"
"A survey on automatic techniques for enhancement and analysis of digital photography","Journal of the Brazilian Computer Society","","19","3","10.1007/s13173-013-0102-1","Claudio S. V. C. CavalcantiHerman Martins GomesJosé Eustáquio Rangel De Queiroz","2013","http://link.springer.com/article/10.1007/s13173-013-0102-1","Article"
"Toward Web mining of cross-language query translations in digital libraries","International Journal on Digital Libraries","","4","4","10.1007/s00799-004-0091-y","Jenq-Haur WangWen-Hsiang LuLee-Feng Chien","2004","http://link.springer.com/article/10.1007/s00799-004-0091-y","Article"
"Attribute CNNs for word spotting in handwritten documents","International Journal on Document Analysis and Recognition (IJDAR)","","","","10.1007/s10032-018-0295-0","Sebastian SudholtGernot A. Fink","2018","http://link.springer.com/article/10.1007/s10032-018-0295-0","Article"
"Multimedia Interfaces: Designing for Diversity","Multimedia Systems and Techniques","","","","10.1007/978-1-4613-1341-0_3","Meera Blattner","1996","http://link.springer.com/chapter/10.1007/978-1-4613-1341-0_3","Chapter"
"Hyper Media News: a fully automated platform for large scale analysis, production and distribution of multimodal news content","Multimedia Tools and Applications","","63","2","10.1007/s11042-011-0859-1","Alberto MessinaMaurizio MontagnuoloRiccardo Di MassaRoberto Borgotallo","2013","http://link.springer.com/article/10.1007/s11042-011-0859-1","Article"
"Farsi and Arabic document images lossy compression based on the mixed raster content model","International Journal on Document Analysis and Recognition (IJDAR)","","12","4","10.1007/s10032-009-0088-6","Hadi GrailuMojtaba LotfizadHadi Sadoghi-Yazdi","2009","http://link.springer.com/article/10.1007/s10032-009-0088-6","Article"
"Multimodal Video Indexing: A Review of the State-of-the-art","Multimedia Tools and Applications","","25","1","10.1023/B:MTAP.0000046380.27575.a5","Cees G.M. SnoekMarcel Worring","2005","http://link.springer.com/article/10.1023/B%3AMTAP.0000046380.27575.a5","Article"
"On foreground — background separation in low quality document images","International Journal of Document Analysis and Recognition (IJDAR)","","8","1","10.1007/s10032-005-0007-4","Utpal GarainThierry PaquetLaurent Heutte","2006","http://link.springer.com/article/10.1007/s10032-005-0007-4","Article"
"From Interactive Open Learner Modelling to Intelligent Mentoring: STyLE-OLM and Beyond","International Journal of Artificial Intelligence in Education","","26","1","10.1007/s40593-015-0087-3","Vania DimitrovaPaul Brna","2016","http://link.springer.com/article/10.1007/s40593-015-0087-3","Article"
"Contextual normalization applied to aircraft gas turbine engine diagnosis","Applied Intelligence","","3","2","10.1007/BF00871892","Peter TurneyMichael Halasz","1993","http://link.springer.com/article/10.1007/BF00871892","Article"
"Low - resolution vehicle recognition based on deep feature fusion","Multimedia Tools and Applications","","","","10.1007/s11042-018-5940-6","Lixia XueXin ZhongRonggui WangJuan YangMin Hu","2018","http://link.springer.com/article/10.1007/s11042-018-5940-6","Article"
"Spectacle-Based Design of Wearable See-Through Display for Accommodation-Free Viewing","Pervasive Computing","","","","10.1007/978-3-540-24646-6_7","Marc von WaldkirchPaul LukowiczGerhard Tröster","2004","http://link.springer.com/chapter/10.1007/978-3-540-24646-6_7","Chapter"
"Diversity Analysis for Ensembles of Word Sequence Recognisers","Structural, Syntactic, and Statistical Pattern Recognition","","","","10.1007/11815921_74","Roman BertolamiHorst Bunke","2006","http://link.springer.com/chapter/10.1007/11815921_74","Chapter"
"On the Discovery of the Semantic Context of Queries by Game-Playing","Flexible Query Answering Systems","","","","10.1007/978-3-540-25957-2_17","Alessandro AgostiniPaolo Avesani","2004","http://link.springer.com/chapter/10.1007/978-3-540-25957-2_17","Chapter"
"Building a General Knowledge Base of Physical Objects for Robots","The Semantic Web","","","","10.1007/978-3-319-47602-5_2","Valerio BasileElena CabrioFabien Gandon","2016","http://link.springer.com/chapter/10.1007/978-3-319-47602-5_2","Chapter"
"Decision-theoretic model to identify printed sources","Multimedia Tools and Applications","","","","10.1007/s11042-018-5938-0","Min-Jen TsaiImam YuadiYu-Han Tao","2018","http://link.springer.com/article/10.1007/s11042-018-5938-0","Article"
"Nonparametric Hidden Markov Models: Principles and Applications to Speech Recognition","Neural Nets","","","","10.1007/978-3-540-45216-4_1","Edmondo Trentin","2003","http://link.springer.com/chapter/10.1007/978-3-540-45216-4_1","Chapter"
"DEBORA: Digital AccEss to BOoks of the RenAissance","International Journal of Document Analysis and Recognition (IJDAR)","","9","2 - 4","10.1007/s10032-006-0030-0","F. Le BourgeoisH. Emptoz","2007","http://link.springer.com/article/10.1007/s10032-006-0030-0","Article"
"Frame Detection over the Semantic Web","The Semantic Web: Research and Applications","","","","10.1007/978-3-642-02121-3_13","Bonaventura CoppolaAldo GangemiAlfio GliozzoDavide PiccaValentina Presutti","2009","http://link.springer.com/chapter/10.1007/978-3-642-02121-3_13","Chapter"
"Efficient OCR Post-Processing Combining Language, Hypothesis and Error Models","Structural, Syntactic, and Statistical Pattern Recognition","","","","10.1007/978-3-642-14980-1_72","Rafael LlobetJ. Ramon Navarro-CerdanJuan-Carlos Perez-CortesJoaquim Arlandis","2010","http://link.springer.com/chapter/10.1007/978-3-642-14980-1_72","Chapter"
"Extracting and analyzing time-series HCI data from screen-captured task videos","Empirical Software Engineering","","22","1","10.1007/s10664-015-9417-1","Lingfeng BaoJing LiZhenchang XingXinyu WangXin XiaBo Zhou","2017","http://link.springer.com/article/10.1007/s10664-015-9417-1","Article"
"Integrating Analysis of Context and Image Content","Principles of Visual Information Retrieval","","","","10.1007/978-1-4471-3702-3_11","Vassilis AthitsosCharles FrankelMichael J. Swain","2001","http://link.springer.com/chapter/10.1007/978-1-4471-3702-3_11","Chapter"
"The effect of tracking technique on the quality of user experience for augmented reality mobile navigation","Multimedia Tools and Applications","","","","10.1007/s11042-017-4810-y","Yoones A. SekhavatJeffrey Parsons","2017","http://link.springer.com/article/10.1007/s11042-017-4810-y","Article"
"Enabling Access to Computers for People with Poor Reading Skills","User-Centered Interaction Paradigms for Universal Access in the Information Society","","","","10.1007/978-3-540-30111-0_8","Albrecht SchmidtThorsten KölblSiegfried WagnerWalter Straßmeier","2004","http://link.springer.com/chapter/10.1007/978-3-540-30111-0_8","Chapter"
"Urdu ligature recognition using multi-level agglomerative hierarchical clustering","Cluster Computing","","","","10.1007/s10586-017-0916-2","Naila Habib KhanAwais AdnanSadia Basar","2017","http://link.springer.com/article/10.1007/s10586-017-0916-2","Article"
"A probabilistic approach to printed document understanding","International Journal on Document Analysis and Recognition (IJDAR)","","14","4","10.1007/s10032-010-0137-1","Eric MedvetAlberto BartoliGiorgio Davanzo","2011","http://link.springer.com/article/10.1007/s10032-010-0137-1","Article"
"TEG—a hybrid approach to information extraction","Knowledge and Information Systems","","9","1","10.1007/s10115-005-0204-y","Ronen FeldmanBenjamin RosenfeldMoshe Fresko","2006","http://link.springer.com/article/10.1007/s10115-005-0204-y","Article"
"Efficient multiscale Sauvola’s binarization","International Journal on Document Analysis and Recognition (IJDAR)","","17","2","10.1007/s10032-013-0209-0","Guillaume LazzaraThierry Géraud","2014","http://link.springer.com/article/10.1007/s10032-013-0209-0","Article"
"Effective Result Inference for Context-Sensitive Tasks in Crowdsourcing","Database Systems for Advanced Applications","","","","10.1007/978-3-319-32025-0_3","Yili FangHailong SunGuoliang LiRichong ZhangJinpeng Huai","2016","http://link.springer.com/chapter/10.1007/978-3-319-32025-0_3","Chapter"
"Discriminative vessel segmentation in retinal images by fusing context-aware hybrid features","Machine Vision and Applications","","25","7","10.1007/s00138-014-0638-x","Erkang ChengLiang DuYi WuYing J. ZhuVasileios MegalooikonomouHaibin Ling","2014","http://link.springer.com/article/10.1007/s00138-014-0638-x","Article"
"iLPR: an Indian license plate recognition system","Multimedia Tools and Applications","","74","23","10.1007/s11042-014-2196-7","Satadal SahaSubhadip BasuMita Nasipuri","2015","http://link.springer.com/article/10.1007/s11042-014-2196-7","Article"
"Special issue on intelligent urban computing with big data","Machine Vision and Applications","","28","7","10.1007/s00138-017-0877-8","Wu LiuPeng CuiJukka K. NurminenJingdong Wang","2017","http://link.springer.com/article/10.1007/s00138-017-0877-8","Article"
"Off-line cursive script recognition: current advances, comparisons and remaining problems","Artificial Intelligence Review","","37","4","10.1007/s10462-011-9229-7","Amjad RehmanTanzila Saba","2012","http://link.springer.com/article/10.1007/s10462-011-9229-7","Article"
"Indexing, Browsing, and Searching of Digital Video and Digital Audio Information","Lectures on Information Retrieval","","","","10.1007/3-540-45368-7_5","Alan F. Smeaton","2001","http://link.springer.com/chapter/10.1007/3-540-45368-7_5","Chapter"
"Robust Object Detection with Interleaved Categorization and Segmentation","International Journal of Computer Vision","","77","1 - 3","10.1007/s11263-007-0095-3","Bastian LeibeAleš LeonardisBernt Schiele","2008","http://link.springer.com/article/10.1007/s11263-007-0095-3","Article"
"A comprehensive study of visual event computing","Multimedia Tools and Applications","","55","3","10.1007/s11042-010-0560-9","WeiQi YanDeclan F. KieranSetareh RafatiradRamesh Jain","2011","http://link.springer.com/article/10.1007/s11042-010-0560-9","Article"
"A Methodology for Constructing User-Oriented Requirements Specifications for Large-Scale Systems Using Electronic Hypermedia","Requirements Engineering","","4","1","10.1007/s007660050008","Scott P. Overmyer","1999","http://link.springer.com/article/10.1007/s007660050008","Article"
"Detecting obfuscated malware using reduced opcode set and optimised runtime trace","Security Informatics","","5","1","10.1186/s13388-016-0027-2","Philip O’kaneSakir SezerKieran McLaughlin","2016","http://link.springer.com/article/10.1186/s13388-016-0027-2","Article"
"The Alchemy of Intelligent IT (iIT): A Blueprint for Future Information Technology","Intelligent Technologies for Information Analysis","","","","10.1007/978-3-662-07952-2_1","Ning ZhongJiming Liu","2004","http://link.springer.com/chapter/10.1007/978-3-662-07952-2_1","Chapter"
"Agent-based decentralised coordination for sensor networks using the max-sum algorithm","Autonomous Agents and Multi-Agent Systems","","28","3","10.1007/s10458-013-9225-1","A. FarinelliA. RogersN. R. Jennings","2014","http://link.springer.com/article/10.1007/s10458-013-9225-1","Article"
"Reversible Interpolation of Vectorial Images by an Anisotropic Diffusion-Projection PDE","International Journal of Computer Vision","","84","2","10.1007/s11263-008-0132-x","Anastasios RoussosPetros Maragos","2009","http://link.springer.com/article/10.1007/s11263-008-0132-x","Article"
"RGB-D Hand-Held Object Recognition Based on Heterogeneous Feature Fusion","Journal of Computer Science and Technology","","30","2","10.1007/s11390-015-1527-0","Xiong LvShu-Qiang JiangLuis HerranzShuang Wang","2015","http://link.springer.com/article/10.1007/s11390-015-1527-0","Article"
"Feature Learning and Deep Learning Architecture Survey","Computer Vision Metrics","","","","10.1007/978-3-319-33762-3_10","Scott Krig","2016","http://link.springer.com/chapter/10.1007/978-3-319-33762-3_10","Chapter"
"Augmented Reality Meets Computer Vision: Efficient Data Generation for Urban Driving Scenes","International Journal of Computer Vision","","","","10.1007/s11263-018-1070-x","Hassan Abu AlhaijaSiva Karthik MustikovelaLars MeschederAndreas GeigerCarsten Rother","2018","http://link.springer.com/article/10.1007/s11263-018-1070-x","Article"
"Summarization of Texts Found on the World Wide Web","Knowledge-Based Information Retrieval and Filtering from the Web","","","","10.1007/978-1-4757-3739-4_5","Marie-Francine MoensRoxana AnghelutaRik De Busser","2003","http://link.springer.com/chapter/10.1007/978-1-4757-3739-4_5","Chapter"
"Personalized retrieval of sports video based on multi-modal analysis and user preference acquisition","Multimedia Tools and Applications","","44","2","10.1007/s11042-009-0291-y","Yi-Fan ZhangChangsheng XuXiaoyu ZhangHanqing Lu","2009","http://link.springer.com/article/10.1007/s11042-009-0291-y","Article"
"Learning, goals, and learning goals: A perspective on goal-driven learning","Artificial Intelligence Review","","9","6","10.1007/BF00849065","David B. LeakeAshwin Ram","1995","http://link.springer.com/article/10.1007/BF00849065","Article"
"Adaptive Navigation of Visually Impaired Users in a Virtual Environment on the World Wide Web","Universal Access Theoretical Perspectives, Practice, and Experience","","","","10.1007/3-540-36572-9_5","Vladislav NemecZdenek MikovecPavel Slavik","2003","http://link.springer.com/chapter/10.1007/3-540-36572-9_5","Chapter"
