Item Title,Publication Title,Book Series Title,Journal Volume,Journal Issue,Item DOI,Authors,Publication Year,URL,Content Type
"When the golden arches gang aft agley: Incorporating software engineering into computer science","Software Engineering Education","","","","10.1007/BFb0017606","Kenneth L. Modesitt Ph.D.","1993","http://link.springer.com/chapter/10.1007/BFb0017606","Chapter"
"An Overview of CrossoverNet","Application Development Systems","","","","10.1007/978-4-431-68051-2_6","Tosiyasu L. KuniiYukari Shirota","1986","http://link.springer.com/chapter/10.1007/978-4-431-68051-2_6","Chapter"
"A Revision of the Literature Concerned with Mobile, Ubiquitous, and Pervasive Learning: A Survey","Mobile, Ubiquitous, and Pervasive Learning","","","","10.1007/978-3-319-26518-6_3","Alejandro Peña-AyalaLeonor Cárdenas","2016","http://link.springer.com/chapter/10.1007/978-3-319-26518-6_3","Chapter"
"GUITAR: an innovative tool for automated testing of GUI-driven software","Automated Software Engineering","","21","1","10.1007/s10515-013-0128-9","Bao N. NguyenBryan RobbinsIshan BanerjeeAtif Memon","2014","http://link.springer.com/article/10.1007/s10515-013-0128-9","Article"
"The Coming Evolution","Creating Internet Intelligence","","","","10.1007/978-1-4615-0561-7_1","Ben GoertzelStephan Vladimir Bugaj","2002","http://link.springer.com/chapter/10.1007/978-1-4615-0561-7_1","Chapter"
"A review of eye-tracking applications as tools for training","Cognition, Technology & Work","","15","3","10.1007/s10111-012-0234-7","Jonathan L. RoschJennifer J. Vogel-Walcutt","2013","http://link.springer.com/article/10.1007/s10111-012-0234-7","Article"
"Concatenation of Multiple Features for Face Recognition","Smart Trends in Information Technology and Computer Communications","","","","10.1007/978-981-10-3433-6_67","Viswanath K. ReddyShruthi B. Gangal","2016","http://link.springer.com/chapter/10.1007/978-981-10-3433-6_67","Chapter"
"Hybrid Digital Signal Processing and Neural Networks for Automated Diagnostics Using Eddy Current Inspection","ICANN ’93","","","","10.1007/978-1-4471-2063-6_227","Wu YanBelle R. Upadhyaya","1993","http://link.springer.com/chapter/10.1007/978-1-4471-2063-6_227","Chapter"
"NLP evaluation: Work and strategies","Evaluating Natural Language Processing Systems","","","","10.1007/BFb0027473","","1996","http://link.springer.com/chapter/10.1007/BFb0027473","Chapter"
"Data Import & Processing","Ontology Learning for the Semantic Web","","","","10.1007/978-1-4615-0925-7_5","Alexander Maedche","2002","http://link.springer.com/chapter/10.1007/978-1-4615-0925-7_5","Chapter"
"SCSMiner: mining social coding sites for software developer recommendation with relevance propagation","World Wide Web","","","","10.1007/s11280-018-0526-9","Yao WanLiang ChenGuandong XuZhou ZhaoJie TangJian Wu","2018","http://link.springer.com/article/10.1007/s11280-018-0526-9","Article"
"Intelligent Multimedia Information Management","Intelligent Multimedia Multi-Agent Systems","","","","10.1007/978-1-4757-3196-5_9","Rajiv KhoslaIshwar K. SethiErnesto Damiani","2000","http://link.springer.com/chapter/10.1007/978-1-4757-3196-5_9","Chapter"
"Max-margin non-negative matrix factorization with flexible spatial constraints based on factor analysis","Frontiers of Computer Science","","10","2","10.1007/s11704-015-4590-3","Dakun LiuXiaoyang Tan","2016","http://link.springer.com/article/10.1007/s11704-015-4590-3","Article"
"The Structure of Locally Orderless Images","International Journal of Computer Vision","","31","2 - 3","10.1023/A:1008065931878","Jan J. KoenderinkAndrea J. Van Doorn","1999","http://link.springer.com/article/10.1023/A%3A1008065931878","Article"
"Robust partial fingerprint recognition using wavelet SIFT descriptors","Pattern Analysis and Applications","","20","4","10.1007/s10044-017-0615-x","Ashok AravindanS. M. Anzar","2017","http://link.springer.com/article/10.1007/s10044-017-0615-x","Article"
"Leveraging 3D City Models for Rotation Invariant Place-of-Interest Recognition","International Journal of Computer Vision","","96","3","10.1007/s11263-011-0458-7","Georges BaatzKevin KöserDavid ChenRadek GrzeszczukMarc Pollefeys","2012","http://link.springer.com/article/10.1007/s11263-011-0458-7","Article"
"Searching Repositories of Web Application Models","Web Engineering","","","","10.1007/978-3-642-13911-6_1","Alessandro BozzonMarco BrambillaPiero Fraternali","2010","http://link.springer.com/chapter/10.1007/978-3-642-13911-6_1","Chapter"
"A History of First Step Fallacies","Minds and Machines","","22","2","10.1007/s11023-012-9276-0","Hubert L. Dreyfus","2012","http://link.springer.com/article/10.1007/s11023-012-9276-0","Article"
"Learning Science by Constructing Models: Can Dragoon Increase Learning without Increasing the Time Required?","International Journal of Artificial Intelligence in Education","","26","4","10.1007/s40593-015-0093-5","Kurt VanLehnGreg ChungSachin GroverAyesha MadniJon Wetzel","2016","http://link.springer.com/article/10.1007/s40593-015-0093-5","Article"
"Steps in Identifying Interaction Design Patterns for Multimodal Systems","Engineering Interactive Systems","","","","10.1007/978-3-540-85992-5_5","Andreas Ratzka","2008","http://link.springer.com/chapter/10.1007/978-3-540-85992-5_5","Chapter"
"Elastic Translation Invariant Matching of Trajectories","Machine Learning","","58","2 - 3","10.1007/s10994-005-5830-9","Michail VlachosGeorge KolliosDimitrios Gunopulos","2005","http://link.springer.com/article/10.1007/s10994-005-5830-9","Article"
"A hybrid approach for classification of rare class data","Knowledge and Information Systems","","","","10.1007/s10115-017-1114-5","Kapil Keshao WankhadeKalpana C. JondhaleVijaya R. Thool","2017","http://link.springer.com/article/10.1007/s10115-017-1114-5","Article"
"MyMap: Generating personalized tourist descriptions","Applied Intelligence","","26","2","10.1007/s10489-006-0012-4","Berardina De CarolisGiovanni CozzolongoSebastiano PizzutiloVincenzo Silvestri","2007","http://link.springer.com/article/10.1007/s10489-006-0012-4","Article"
"The framework: Scope and concepts","Evaluating Natural Language Processing Systems","","","","10.1007/BFb0027472","","1996","http://link.springer.com/chapter/10.1007/BFb0027472","Chapter"
"Learning Bayesian networks: The combination of knowledge and statistical data","Machine Learning","","20","3","10.1007/BF00994016","David HeckermanDan GeigerDavid M. Chickering","1995","http://link.springer.com/article/10.1007/BF00994016","Article"
"Learning Bayesian Networks: The Combination of Knowledge and Statistical Data","Machine Learning","","20","3","10.1023/A:1022623210503","David HeckermanDan GeigerDavid M. Chickering","1995","http://link.springer.com/article/10.1023/A%3A1022623210503","Article"
"An augmented reality interface to contextual information","Virtual Reality","","15","2 - 3","10.1007/s10055-010-0183-5","Antti AjankiMark BillinghurstHannes GamperToni JärvenpääMelih KandemirSamuel KaskiMarkus KoskelaMikko KurimoJorma LaaksonenKai PuolamäkiTeemu RuokolainenTimo Tossavainen","2011","http://link.springer.com/article/10.1007/s10055-010-0183-5","Article"
"Text comprehension and the computational mind-agencies","Natural Computing","","14","4","10.1007/s11047-014-9478-x","Romi BanerjeeSankar K. Pal","2015","http://link.springer.com/article/10.1007/s11047-014-9478-x","Article"
"Analysis of 3D signatures recorded using leap motion sensor","Multimedia Tools and Applications","","","","10.1007/s11042-017-5011-4","Santosh Kumar BeheraDebi Prosad DograPartha Pratim Roy","2017","http://link.springer.com/article/10.1007/s11042-017-5011-4","Article"
"Computer linguistics in IntellSyst","Automatic Documentation and Mathematical Linguistics","","43","1","10.3103/S0005105509010038","A. A. KrasilovR. D. Grigoryev","2009","http://link.springer.com/article/10.3103/S0005105509010038","Article"
"A Social Stability Analysis System Based on Web Sensitive Information Mining","Big Data Technology and Applications","","","","10.1007/978-981-10-0457-5_6","Wei Wang","2016","http://link.springer.com/chapter/10.1007/978-981-10-0457-5_6","Chapter"
"Multilingual WWW","Knowledge-Based Information Retrieval and Filtering from the Web","","","","10.1007/978-1-4757-3739-4_9","Feiyu Xu","2003","http://link.springer.com/chapter/10.1007/978-1-4757-3739-4_9","Chapter"
"Quality of Web Data and Quality of Big Data: Open Problems","Data and Information Quality","","","","10.1007/978-3-319-24106-7_14","Monica ScannapiecoLaure Berti","2016","http://link.springer.com/chapter/10.1007/978-3-319-24106-7_14","Chapter"
"A survey on instance selection for active learning","Knowledge and Information Systems","","35","2","10.1007/s10115-012-0507-8","Yifan FuXingquan ZhuBin Li","2013","http://link.springer.com/article/10.1007/s10115-012-0507-8","Article"
"Formal and relational concept analysis for fuzzy-based automatic semantic annotation","Applied Intelligence","","40","1","10.1007/s10489-013-0451-7","C. De MaioG. FenzaM. GalloV. LoiaS. Senatore","2014","http://link.springer.com/article/10.1007/s10489-013-0451-7","Article"
"Introduction","Anaphora Resolution","","","","10.1007/978-3-662-47909-4_1","Roland Stuckardt","2016","http://link.springer.com/chapter/10.1007/978-3-662-47909-4_1","Chapter"
"A hybrid approach for content extraction with text density and visual importance of DOM nodes","Knowledge and Information Systems","","42","1","10.1007/s10115-013-0687-x","Dandan SongFei SunLejian Liao","2015","http://link.springer.com/article/10.1007/s10115-013-0687-x","Article"
"Neural Networks for Graphics and Imaging","Visual Computing","","","","10.1007/978-3-642-85023-3_7","Markus Groß","1994","http://link.springer.com/chapter/10.1007/978-3-642-85023-3_7","Chapter"
"Fourier–Mellin registration of line-delineated tabular document images","International Journal of Document Analysis and Recognition (IJDAR)","","8","2 - 3","10.1007/s10032-005-0003-8","Luke A. D. HutchisonWilliam A. Barrett","2006","http://link.springer.com/article/10.1007/s10032-005-0003-8","Article"
"Semantic audiovisual asset model","Multimedia Tools and Applications","","63","3","10.1007/s11042-011-0883-1","Benjamin DiemertMarie-Hélène AbelClaude Moulin","2013","http://link.springer.com/article/10.1007/s11042-011-0883-1","Article"
"The H-N2N framework: towards providing interperception in massive applications","Multimedia Tools and Applications","","45","1 - 3","10.1007/s11042-009-0305-9","Aquiles M. F. BurlamaquiSamuel O. AzevedoRummenigge Rudson DantasClaudio A. SchneiderJosivan S. XavierJulio C. P. MeloLuiz M. G. GonçalvesGuido L. S. FilhoJauvane C. de Oliveira","2009","http://link.springer.com/article/10.1007/s11042-009-0305-9","Article"
"Automatic extraction of printed mathematical formulas using fuzzy logic and propagation of context","International Journal on Document Analysis and Recognition","","4","2","10.1007/s100320100064","A. KacemA. BelaïdM. Ben Ahmed","2001","http://link.springer.com/article/10.1007/s100320100064","Article"
"Mobile Note Taking: Investigating the Efficacy of Mobile Text Entry","Mobile Human-Computer Interaction - MobileHCI 2004","","","","10.1007/978-3-540-28637-0_14","Joanna LumsdenAndrew Gammell","2004","http://link.springer.com/chapter/10.1007/978-3-540-28637-0_14","Chapter"
"Leveraging corporate context within knowledge-based document analysis and understanding","International Journal on Document Analysis and Recognition","","3","4","10.1007/PL00013567","Claudia WenzelHeiko Maus","2001","http://link.springer.com/article/10.1007/PL00013567","Article"
"Restoration of Old Documents with Genetic Algorithms","Applications of Evolutionary Computing","","","","10.1007/3-540-36605-9_40","Daniel RiveroRafael VidalJulián DoradoJuan R. RabuñalAlejandro Pazos","2003","http://link.springer.com/chapter/10.1007/3-540-36605-9_40","Chapter"
"The effect of previous exposure to technology on acceptance and its importance in usability and accessibility engineering","Universal Access in the Information Society","","10","3","10.1007/s10209-010-0212-x","Andreas HolzingerGig SearleMichaela Wernbacher","2011","http://link.springer.com/article/10.1007/s10209-010-0212-x","Article"
"Genetic optimized artificial immune system in spam detection: a review and a model","Artificial Intelligence Review","","40","3","10.1007/s10462-011-9285-z","Raed Abu ZitarAdel Hamdan","2013","http://link.springer.com/article/10.1007/s10462-011-9285-z","Article"
"A Knowledge-Based Multimedia Distributed System Model","Knowledge, Data and Computer-Assisted Decisions","","","","10.1007/978-3-642-84218-4_18","Danco DavcevDusan CakmakovVanco Cabukovski","1990","http://link.springer.com/chapter/10.1007/978-3-642-84218-4_18","Chapter"
"Understanding Software","Software Design — Cognitive Aspects","","","","10.1007/978-1-4471-0111-6_6","Françoise Détienne PhD","2002","http://link.springer.com/chapter/10.1007/978-1-4471-0111-6_6","Chapter"
"Errors in the CGM Standard","CGM in the Real World","","","","10.1007/978-3-642-73629-2_23","Anne MumfordMark Skall","1988","http://link.springer.com/chapter/10.1007/978-3-642-73629-2_23","Chapter"
"“Making it real”: exploring the potential of augmented reality for teaching primary school science","Virtual Reality","","10","3 - 4","10.1007/s10055-006-0036-4","Lucinda KerawallaRosemary LuckinSimon SeljeflotAdrian Woolard","2006","http://link.springer.com/article/10.1007/s10055-006-0036-4","Article"
"Modeling Student Knowledge: Cognitive Tutors in High School and College","User Modeling and User-Adapted Interaction","","10","2 - 3","10.1023/A:1026505626690","Albert CorbettMegan McLaughlinK. Christine Scarpinatto","2000","http://link.springer.com/article/10.1023/A%3A1026505626690","Article"
"Cultivating a research agenda for data science","Journal Of Big Data","","1","1","10.1186/2196-1115-1-6","Chris A Mattmann","2014","http://link.springer.com/article/10.1186/2196-1115-1-6","Article"
"Introduction to the Special Issue on Meta-Learning","Machine Learning","","54","3","10.1023/B:MACH.0000015878.60765.42","Christophe Giraud-CarrierRicardo VilaltaPavel Brazdil","2004","http://link.springer.com/article/10.1023/B%3AMACH.0000015878.60765.42","Article"
"Text Mining via Information Extraction","Principles of Data Mining and Knowledge Discovery","","","","10.1007/978-3-540-48247-5_18","Ronen FeldmanYonatan AumannMoshe FreskoOrly LiphstatBinyamin RosenfeldYonatan Schler","1999","http://link.springer.com/chapter/10.1007/978-3-540-48247-5_18","Chapter"
"ECHO: a digital library for historical film archives","International Journal on Digital Libraries","","4","1","10.1007/s00799-003-0062-8","Pasquale SavinoCarol Peters","2004","http://link.springer.com/article/10.1007/s00799-003-0062-8","Article"
"Estimating the information gap between textual and visual representations","International Journal of Multimedia Information Retrieval","","7","1","10.1007/s13735-017-0142-y","Christian HenningRalph Ewerth","2018","http://link.springer.com/article/10.1007/s13735-017-0142-y","Article"
"A Sequential Minimal Optimization Algorithm for the All-Distances Support Vector Machine","Progress in Pattern Recognition, Image Analysis, Computer Vision, and Applications","","","","10.1007/978-3-642-16687-7_64","Diego CandelRicardo ÑanculefCarlos ConchaHéctor Allende","2010","http://link.springer.com/chapter/10.1007/978-3-642-16687-7_64","Chapter"
"Automatic Keyword Extraction from Historical Document Images","Document Analysis Systems VII","","","","10.1007/11669487_37","Kengo TerasawaTakeshi NagasakiToshio Kawashima","2006","http://link.springer.com/chapter/10.1007/11669487_37","Chapter"
"A Flexible and Efficient ML Lexer Tool Based on Extended Regular Expression Submatching","Compiler Construction","","","","10.1007/978-3-642-54807-9_10","Martin SulzmannPippijn van Steenhoven","2014","http://link.springer.com/chapter/10.1007/978-3-642-54807-9_10","Chapter"
"A Semantic Search Engine for the International Relation Sector","The Semantic Web – ISWC 2005","","","","10.1007/11574620_71","L. RodrigoV. R BenjaminsJ. ContrerasD. PatónD. NavarroR. SallaM. BlázquezP. TenaI. Martos","2005","http://link.springer.com/chapter/10.1007/11574620_71","Chapter"
"Tree-Structured Conditional Random Fields for Semantic Annotation","The Semantic Web - ISWC 2006","","","","10.1007/11926078_46","Jie TangMingcai HongJuanzi LiBangyong Liang","2006","http://link.springer.com/chapter/10.1007/11926078_46","Chapter"
"Fiction for Design: Appropriating Hollywood Techniques for Design Fictions","Digital Make-Believe","","","","10.1007/978-3-319-29553-4_4","Tom Flint","2016","http://link.springer.com/chapter/10.1007/978-3-319-29553-4_4","Chapter"
"Creating Digital Resources from Legacy Documents: An Experience Report from the Biosystematics Domain","The Semantic Web: Research and Applications","","","","10.1007/978-3-642-02121-3_54","Guido SautterKlemens BöhmDonat AgostiChristiana Klingenberg","2009","http://link.springer.com/chapter/10.1007/978-3-642-02121-3_54","Chapter"
"A Design Process for Exhibiting Design Choices and Trade-Offs in (Potentially) Conflicting User Interface Guidelines","Human-Centered Software Engineering","","","","10.1007/978-3-642-34347-6_4","Llúcia MasipCélia MartinieMarco WincklerPhilippe PalanqueToni GranollersMarta Oliva","2012","http://link.springer.com/chapter/10.1007/978-3-642-34347-6_4","Chapter"
"Autonomous Context-Based Service Optimization in Mobile Cloud Computing","Journal of Grid Computing","","15","3","10.1007/s10723-017-9406-2","Piotr NawrockiBartlomiej Sniezynski","2017","http://link.springer.com/article/10.1007/s10723-017-9406-2","Article"
"An efficient content based image retrieval system using BayesNet and K-NN","Multimedia Tools and Applications","","","","10.1007/s11042-017-5587-8","Munish KumarPayal ChhabraNaresh Kumar Garg","2018","http://link.springer.com/article/10.1007/s11042-017-5587-8","Article"
"A Hybrid Mobility Prediction (HMP) strategy for PCS networks","Pattern Analysis and Applications","","19","1","10.1007/s10044-015-0483-1","Ahmed Ibrahim Mohammed Saleh","2016","http://link.springer.com/article/10.1007/s10044-015-0483-1","Article"
"A deep semantic framework for multimodal representation learning","Multimedia Tools and Applications","","75","15","10.1007/s11042-016-3380-8","Cheng WangHaojin YangChristoph Meinel","2016","http://link.springer.com/article/10.1007/s11042-016-3380-8","Article"
"GARUDA: Gaussian dissimilarity measure for feature representation and anomaly detection in Internet of things","The Journal of Supercomputing","","","","10.1007/s11227-018-2397-3","Shadi A. AljawarnehRadhakrishna Vangipuram","2018","http://link.springer.com/article/10.1007/s11227-018-2397-3","Article"
"Bayesian real-time perception algorithms on GPU","Journal of Real-Time Image Processing","","6","3","10.1007/s11554-010-0156-7","João Filipe FerreiraJorge LoboJorge Dias","2011","http://link.springer.com/article/10.1007/s11554-010-0156-7","Article"
"A GPU-based (8, 4) Hamming decoder for secure transmission of watermarked medical images","Cluster Computing","","18","1","10.1007/s10586-014-0392-x","Md. Shohidul IslamCheol-Hong KimJong-Myon Kim","2015","http://link.springer.com/article/10.1007/s10586-014-0392-x","Article"
"Spatio-Temporal Formalization of Video Events","Content-Based Video Retrieval","","","","10.1007/978-1-4757-4865-9_4","Milan PetkovićWillem Jonker","2004","http://link.springer.com/chapter/10.1007/978-1-4757-4865-9_4","Chapter"
"Integration of audiovisual sensors and technologies in a smart room","Personal and Ubiquitous Computing","","13","1","10.1007/s00779-007-0172-1","Joachim NeumannJosep R. CasasDušan MachoJavier Ruiz Hidalgo","2009","http://link.springer.com/article/10.1007/s00779-007-0172-1","Article"
"Discovery of trading points based on Bayesian modeling of trading rules","World Wide Web","","","","10.1007/s11280-018-0534-9","Qinghua HuangZhoufan KongYanshan LiJie YangXuelong Li","2018","http://link.springer.com/article/10.1007/s11280-018-0534-9","Article"
"The Role of Focus in Advanced Visual Interfaces","KI - Künstliche Intelligenz","","30","3 - 4","10.1007/s13218-015-0411-y","Jason OrloskyTakumi ToyamaDaniel SonntagKiyoshi Kiyokawa","2016","http://link.springer.com/article/10.1007/s13218-015-0411-y","Article"
"Automatic gaze-based user-independent detection of mind wandering during computerized reading","User Modeling and User-Adapted Interaction","","26","1","10.1007/s11257-015-9167-1","Robert BixlerSidney D’Mello","2016","http://link.springer.com/article/10.1007/s11257-015-9167-1","Article"
"Using disability data to estimate design exclusion","Universal Access in the Information Society","","9","3","10.1007/s10209-009-0168-x","S. D. WallerP. M. LangdonP. J. Clarkson","2010","http://link.springer.com/article/10.1007/s10209-009-0168-x","Article"
"Event detection over twitter social media streams","The VLDB Journal","","23","3","10.1007/s00778-013-0320-3","Xiangmin ZhouLei Chen","2014","http://link.springer.com/article/10.1007/s00778-013-0320-3","Article"
"A New Region-based Active Contour Model for Object Segmentation","Journal of Mathematical Imaging and Vision","","53","2","10.1007/s10851-015-0574-z","Michela LeccaStefano MesselodiRaul Paolo Serapioni","2015","http://link.springer.com/article/10.1007/s10851-015-0574-z","Article"
"Augmented Reality Painting and Collage: Evaluating Tangible Interaction in a Field Study","Human-Computer Interaction - INTERACT 2005","","","","10.1007/11555261_7","Giulio JacucciAntti OulasvirtaAntti SalovaaraThomas PsikIna Wagner","2005","http://link.springer.com/chapter/10.1007/11555261_7","Chapter"
"Toward location-aware Web: extraction method, applications and evaluation","Personal and Ubiquitous Computing","","18","5","10.1007/s00779-013-0718-3","Basil HessFabio MagagnaJuliana Sutanto","2014","http://link.springer.com/article/10.1007/s00779-013-0718-3","Article"
"Extracting information from free text radiology reports","International Journal on Digital Libraries","","1","3","10.1007/s007990050024","David B. JohnsonRicky K. TairaAlfonso F. CardenasDenise R. Aberle","1997","http://link.springer.com/article/10.1007/s007990050024","Article"
"Recent progress and trends in predictive visual analytics","Frontiers of Computer Science","","11","2","10.1007/s11704-016-6028-y","Junhua LuWei ChenYuxin MaJunming KeZongzhuang LiFan ZhangRoss Maciejewski","2017","http://link.springer.com/article/10.1007/s11704-016-6028-y","Article"
"Ant Colony Metaphor Applied in User Interface Recommendation","New Generation Computing","","26","3","10.1007/s00354-008-0045-9","Janusz Sobecki","2008","http://link.springer.com/article/10.1007/s00354-008-0045-9","Article"
"A system for ranking organizations using social scale analysis","Social Network Analysis and Mining","","3","3","10.1007/s13278-012-0072-x","Sukru TikvesSujogya BanerjeeHamy TemkitSedat GokalpHasan DavulcuArunaba SenSteven CormanMark WoodwardShreejay NairInayah RohmaniyahAli Amin","2013","http://link.springer.com/article/10.1007/s13278-012-0072-x","Article"
"An FW-BF Based Approach on Elimination of Duplicated Web Pages","Intelligent Data Engineering and Automated Learning – IDEAL 2016","","","","10.1007/978-3-319-46257-8_20","Leiming MaZhengyou Xia","2016","http://link.springer.com/chapter/10.1007/978-3-319-46257-8_20","Chapter"
"How evolutionary algorithms are applied to statistical natural language processing","Artificial Intelligence Review","","28","4","10.1007/s10462-009-9104-y","Lourdes Araujo","2007","http://link.springer.com/article/10.1007/s10462-009-9104-y","Article"
"Learning an Approximation to Inductive Logic Programming Clause Evaluation","Inductive Logic Programming","","","","10.1007/978-3-540-30109-7_10","Frank DiMaioJude Shavlik","2004","http://link.springer.com/chapter/10.1007/978-3-540-30109-7_10","Chapter"
"Modeling cause and effect in legal text","Conceptual Structures: Fulfilling Peirce's Dream","","","","10.1007/BFb0027874","Judith P. Dick","1997","http://link.springer.com/chapter/10.1007/BFb0027874","Chapter"
"Large-scale Gaussian process classification using random decision forests","Pattern Recognition and Image Analysis","","22","1","10.1134/S1054661812010166","B. FröhlichE. RodnerM. KemmlerJ. Denzler","2012","http://link.springer.com/article/10.1134/S1054661812010166","Article"
"A Case Based System for Oil and Gas Well Design with Risk Assessment","Applied Intelligence","","23","1","10.1007/s10489-005-2371-7","Simon KravisRosemary Irrgang","2005","http://link.springer.com/article/10.1007/s10489-005-2371-7","Article"
"Towards Universal Text Retrieval: Tipster Text Retrieval Research at New Mexico State University","Information Retrieval","","3","4","10.1023/A:1009907816505","Mark W. DavisWilliam C. Ogden","2000","http://link.springer.com/article/10.1023/A%3A1009907816505","Article"
"Using OLAP and Data Mining for Content Planning in Natural Language Generation","Natural Language Processing and Information Systems","","","","10.1007/3-540-45399-7_14","Eloi L. FaveroJacques Robin","2001","http://link.springer.com/chapter/10.1007/3-540-45399-7_14","Chapter"
"Coalition for networked information, S pring 1995","Archives and Museum Informatics","","9","2","10.1007/BF02770456","","1995","http://link.springer.com/article/10.1007/BF02770456","Article"
"Foreword","International Journal on Digital Libraries","","1","3","10.1007/s007990050015","","1997","http://link.springer.com/article/10.1007/s007990050015","Article"
"Web News Extraction via Tag Path Feature Fusion Using DS Theory","Journal of Computer Science and Technology","","31","4","10.1007/s11390-016-1655-1","Gong-Qing WuLei LiLi LiXindong Wu","2016","http://link.springer.com/article/10.1007/s11390-016-1655-1","Article"
